{
  "config_metadata": {
    "config_id": "DEFI_PROT_COMPOUND_V3",
    "description": "Compound V3 (Comet) protocol profile - single base asset (USDC), conservative LTV parameters",
    "version": "1.0.0",
    "collection_file": "DeFi-CollateralRebalancing-CorrelationRisk-90d.json"
  },

  "protocol": {
    "source": "file",
    "file": "protocols/compound-v3.json"
  },

  "protocol_thresholds": {
    "source": "inline",
    "inline": {
      "min_health_factor_trigger": 1.0,
      "healthy_health_factor": 1.35,
      "target_health_factor": 1.80,
      "max_liquidation_bonus": 0.08,
      "max_cascade_depth": 2,
      "min_collateral_ratio": 1.30,
      "gas_price_gwei_limit": 120,
      "max_slippage_tolerance": 0.015,
      "liquidation_close_factor": 1.0,
      "protocol_fee_bps": 5
    }
  },

  "market_scenario": {
    "source": "file",
    "file": "market-scenarios/moderate-correction.json"
  },

  "liquidation_scenario": {
    "source": "file",
    "file": "liquidation-scenarios/approaching-threshold.json"
  },

  "simulation_timeframe": {
    "status_date": "2026-02-28T00:00:00",
    "start_date": "2026-03-01T00:00:00",
    "end_date": "2026-05-31T00:00:00",
    "frequency": "daily"
  }
}
